{
  "schema_version": 1,
  "device_id": "plc-filler-01",
  "ts": "2026-09-26T10:15:30.123Z",
  "seq": 102934,
  "status": "RUN",
  "tags": {
    "speed_bpm": 118.5,
    "fill_volume_ml": 500.8,
    "product_temp_c": 6.4,
    "reject_count": 42,
    "bottle_count": 18234,
    "door_closed": true,
    "recipe": "COLA-500"
  }
}
